{"algorithm":"Ed25519","envelope_schema_version":1,"key_id":"uap-directory-2026-01","sequence":43,"signature":"zjQyqALc68qVL+DjEbWlrmlqNfF/T5W7Ozjwl7KYr8xVp/2Ae5be/DFKXpwze/D9umSGCh2lK78JB8Fs/h7dBg==","signature_domain":"UAP-DIRECTORY-SNAPSHOT-ED25519-V1","snapshot_digest":"sha256:7ffb6078ac08e7ed00575dbf9a871b0dba53c755591d8983dd9399bfdc4edaf6","snapshot_schema_version":1}
