{"algorithm":"Ed25519","envelope_schema_version":1,"key_id":"test-next","sequence":7,"signature":"n0BixEc+H0gBcClO6v1li610CY5JkBGH4C4X3lfhUBiaWl9eOWDhklHubVsn47+YnslDHxzF/mpCy1h47jX/AQ==","signature_domain":"UAP-DIRECTORY-SNAPSHOT-ED25519-V1","snapshot_digest":"sha256:b2fcd718a58c5044919c7c98e339d703faed721aecee4aeca01a3f4f5be0b908","snapshot_schema_version":1}
