{"algorithm":"Ed25519","envelope_schema_version":1,"key_id":"test-current","sequence":7,"signature":"d0XGn1ChLqzGEymMNa8DIrl/9AvO8DKP7OzpPrCOsJ7IjzE2UfBJLwkqcabwurUjS8Y3wyNrPAqQVPWNqjG8DA==","signature_domain":"UAP-DIRECTORY-SNAPSHOT-ED25519-V1","snapshot_digest":"sha256:b2fcd718a58c5044919c7c98e339d703faed721aecee4aeca01a3f4f5be0b908","snapshot_schema_version":1}
